{
  "version": 2,
  "repoBase": "https://raw.githubusercontent.com/ReBoticsAI/GodMode-Marketplace/main",
  "updatedAt": "2026-08-27T21:50:36.000Z",
  "entries": [
    {
      "id": "community-ping",
      "kind": "plugin",
      "installType": "plugin",
      "title": "Community Ping",
      "description": "Tiny OSS health-ping tool. Adds a community_ping Bridge tool that returns process health and can optionally fetch example.com.",
      "version": "0.1.0",
      "author": "DaneSchell",
      "tags": [
        "community",
        "health",
        "tools",
        "oss"
      ],
      "pluginRepo": "https://github.com/ReBoticsAI/gm-442-smoke-test",
      "pluginRef": "797f1556cbf3291a57502323e529c16fc638e3c6",
      "pluginDigest": "797f1556cbf3291a57502323e529c16fc638e3c6",
      "artifactSha256": "ded97a9625e52dbef57952091b0492dc622c0d1815933ac2275301e2963848fc"
    },
    {
      "id": "workspace-pulse",
      "kind": "plugin",
      "installType": "plugin",
      "title": "Workspace Pulse",
      "description": "Tiny OSS health-ping tool. Adds a workspace_pulse_ping Bridge tool that returns process health for this workspace.",
      "version": "0.1.0",
      "author": "DaneSchell",
      "tags": [
        "community",
        "health",
        "tools",
        "oss"
      ],
      "pluginRepo": "https://github.com/DaneSchell/godmode-workspace-pulse",
      "pluginRef": "be72adcf93dce8fcb5b49de2ee45684386474427",
      "pluginDigest": "be72adcf93dce8fcb5b49de2ee45684386474427",
      "artifactSha256": "97fc7ea41aab6ecd361397fea56ed728fdd9636b04d04996b5de0bda280cc448",
      "ciRunUrl": "https://github.com/DaneSchell/godmode-workspace-pulse/actions/runs/31916550440"
    },
    {
      "id": "live-share-smoke",
      "kind": "skill",
      "installType": "clone",
      "deliveryMode": "live",
      "title": "Live Share Smoke",
      "description": "Community Live Share smoke pack: bind a matching skill export to this pin.",
      "version": "0.1.0",
      "author": "DaneSchell",
      "tags": [
        "community",
        "live",
        "smoke"
      ],
      "pluginRepo": "https://github.com/ReBoticsAI/godmode-live-share-smoke",
      "pluginRef": "ff221e7cd18051279d404514cc8cf9c5a3ad1122",
      "pluginDigest": "ff221e7cd18051279d404514cc8cf9c5a3ad1122",
      "bundlePath": "bundle.json"
    }
  ]
}
